Nr.;Themengebiet;Frage;Option A;Option B;Option C;Option D;Richtig;Vollständige Antwort;Schwierigkeit
1;Das kranke Kind;Ein Säugling erbricht schwallartig im Strahl. An welche Diagnose ist zu denken?;Gastroösophagealer Reflux (GERD);Akute virale Gastroenteritis;Akute Invagination;Hypertrophe Pylorusstenose.;D;Hypertrophe Pylorusstenose.;leicht
2;Das kranke Kind;Welches Anamnesemerkmal beim Husten weist typischerweise auf Pertussis (Keuchhusten) hin?;Bellig-trockener Husten vor allem morgens;Stakkatoartiger Husten (anfallsartig, in Salven).;Produktiver Husten mit eitrigem Sputum;Trockener Reizhusten bei Belastung;B;Stakkatoartiger Husten (anfallsartig, in Salven).;leicht
3;Das kranke Kind;Ein Kind hat entfärbten (acholischen) Stuhl. Worauf weist dieser Befund hin?;Auf eine Cholestase.;Schweres Malabsorptionssyndrom (Zöliakie);Akute bakterielle Gastroenteritis;Obere gastrointestinale Blutung;A;Auf eine Cholestase.;mittel
4;Das kranke Kind;Welches okuläre Zeichen (?Sonnenuntergangsphänomen?) deutet beim Säugling auf eine bestimmte Pathologie hin?;Angeborenes Glaukom (Buphthalmus);Fortgeschrittenes Retinoblastom;Auf erhöhten Hirndruck.;Angeborene Fazialisparese;C;Auf erhöhten Hirndruck.;mittel
5;Das kranke Kind;Fehlende Leistenpulse bei der körperlichen Untersuchung sind verdächtig auf welche Fehlbildung?;Großer Ventrikelseptumdefekt (VSD);Persistierender Ductus arteriosus (PDA);Aortenisthmusstenose (Coarctatio aortae).;Klassische Fallot-Tetralogie;C;Aortenisthmusstenose (Coarctatio aortae).;mittel
6;Das kranke Kind;Welche Pupillenveränderung spricht für eine Opioid- bzw. Cholinergika-Intoxikation, welche für eine Anticholinergika-Intoxikation?;Mydriasis bei Opioid-Intoxikation;Beidseitige träge Pupillenreaktion;Miosis (enge Pupillen) bei Opioid-/Cholinergika-Intoxikation, Mydriasis (weite Pupillen) bei Anticholinergika-Intoxikation.;Vertikale Entrundung der Pupillen;C;Miosis (enge Pupillen) bei Opioid-/Cholinergika-Intoxikation, Mydriasis (weite Pupillen) bei Anticholinergika-Intoxikation.;mittel
7;Genetik/Syndromologie;Welcher Karyotyp liegt dem Ullrich-Turner-Syndrom zugrunde und welches Geschlecht ist betroffen?;"Karyotyp 47,XXY; betrifft Jungen";"45,X0 (Monosomie X); betroffen sind Mädchen.";"Karyotyp 47,XX+21; betrifft Mädchen";"Karyotyp 46,XY; Deletion 5p";B;"45,X0 (Monosomie X); betroffen sind Mädchen.";leicht
8;Genetik/Syndromologie;Welche kardiale Fehlbildung ist beim Ullrich-Turner-Syndrom typisch?;Transposition der großen Arterien (TGA);Hypoplastisches Linksherzsyndrom (HLHS);"Aortenisthmusstenose bzw. bikuspide Aortenklappe; erhöhtes Risiko für Aortendissektion.";Totale fehlerhafte Lungenvenenmündung;C;"Aortenisthmusstenose bzw. bikuspide Aortenklappe; erhöhtes Risiko für Aortendissektion.";mittel
9;Genetik/Syndromologie;Welcher Karyotyp und welche endokrine Störung kennzeichnen das Klinefelter-Syndrom?;"Karyotyp 45,X0; hypogonadotroper Hypogonadismus";"Karyotyp 47,XYY; vorzeitige Pubarche";"Karyotyp 47,XXY; hypergonadotroper Hypogonadismus (Therapie mit Testosteron).";"Karyotyp 46,XX; primäre NNR-Insuffizienz";C;"Karyotyp 47,XXY; hypergonadotroper Hypogonadismus (Therapie mit Testosteron).";leicht
10;Genetik/Syndromologie;Das Fragile-X-Syndrom ist die häufigste monogene Ursache geistiger Behinderung. Welches Gen und welche Mutationsart liegen zugrunde?;"MECP2-Gen auf dem X-Chromosom; Punktmutation";"SMN1-Gen auf Chromosom 5; homozygote Deletion";"FBN1-Gen auf Chromosom 15; Missense-Mutation";"FMR1-Gen auf dem X-Chromosom; Verlängerung eines CGG-Trinukleotid-Repeats (Vollmutation >200 Repeats) mit Abschalten der Genexpression.";D;"FMR1-Gen auf dem X-Chromosom; Verlängerung eines CGG-Trinukleotid-Repeats (Vollmutation >200 Repeats) mit Abschalten der Genexpression.";schwer
11;Genetik/Syndromologie;Nennen Sie typische klinische Merkmale des Fragilen-X-Syndroms bei Jungen.;Langes schmales Gesicht, große Ohren, prominentes Kinn (Progenie), Makroorchidie (ab Pubertät), Entwicklungsverzögerung (Sprache > Motorik).;Rundes, flaches Gesicht, Epikanthus, Sandalenlücke;Dreieckiges Gesicht, blaue Skleren, Gelenkhypermobilität;Mikrozephalie, Synophrys, ausgeprägter Minderwuchs;A;Langes schmales Gesicht, große Ohren, prominentes Kinn (Progenie), Makroorchidie (ab Pubertät), Entwicklungsverzögerung (Sprache > Motorik).;mittel
12;Genetik/Syndromologie;Welche chromosomale Veränderung liegt dem DiGeorge-/22q11.2-Deletionssyndrom zugrunde und welches Gen ist für die kardiovaskulären Symptome verantwortlich?;"Mikrodeletion 22q11.2; das TBX1-Gen ist für die kardiovaskulären Symptome (konotrunkale Defekte) verantwortlich.";"Mikroduplikation 22q11.2; SHANK3-Gen Defekt";"Mikrodeletion 15q11.2; UBE3A-Gen Defekt";"Reziproke Translokation t(11;22); EWSR1-Gen Defekt";A;"Mikrodeletion 22q11.2; das TBX1-Gen ist für die kardiovaskulären Symptome (konotrunkale Defekte) verantwortlich.";schwer
13;Genetik/Syndromologie;Welche Trias aus Organbeteiligung ist beim DiGeorge-Syndrom klassisch?;Konotrunkaler Herzfehler, Thymushypo-/-aplasie (T-Zell-Defekt) und Hypoparathyreoidismus (hypokalzämische Krämpfe).;Hypertrophe Kardiomyopathie, Hepatomegalie;Vorhofseptumdefekt, autoimmune Hypothyreose;Supravalvuläre Aortenstenose, B-Zell-Immundefekt;A;Konotrunkaler Herzfehler, Thymushypo-/-aplasie (T-Zell-Defekt) und Hypoparathyreoidismus (hypokalzämische Krämpfe).;schwer
14;Genetik/Syndromologie;Welche Mikrodeletion liegt dem Williams-Beuren-Syndrom zugrunde und welche kardiovaskuläre Fehlbildung ist typisch?;"Mikrodeletion 4p16.3; großer VSD";"Mikrodeletion 5p15.3; hypoplastische Pulmonalarterie";"Mikrodeletion 11q23; bikuspide Aortenklappe";"Mikrodeletion 7q11.23 (Elastin-Gen); typisch ist die supravalvuläre Aortenstenose; zusätzlich Hyperkalzämie.";D;"Mikrodeletion 7q11.23 (Elastin-Gen); typisch ist die supravalvuläre Aortenstenose; zusätzlich Hyperkalzämie.";schwer
15;Genetik/Syndromologie;Welche Wesensart zeigen Kinder mit Williams-Beuren-Syndrom häufig im Verlauf?;Frühkindlich autistisches Verhalten;Aggressives, impulsives und autoaggressives Verhalten;Im Kindesalter eher scheu, als Erwachsene extrovertiert und teils distanzlos (?freundliches/soziales? Wesen).;Apathisches, antriebsarmes Wesen;C;Im Kindesalter eher scheu, als Erwachsene extrovertiert und teils distanzlos (?freundliches/soziales? Wesen).;mittel
16;Genetik/Syndromologie;Beckwith-Wiedemann-Syndrom: Nennen Sie die charakteristische klinische Trias bei Geburt.;Mikrozephalie, Mikrophallismus und Zwerchfellhernie;Makrosomie, Laryngomalazie und Duodenalatresie;Pränatale Wachstumsretardierung, Holoprosenzephalie;"Makrosomie, Makroglossie und Bauchwanddefekt (z. B. Omphalozele/Nabelhernie); zudem neonatale Hypoglykämie.";D;"Makrosomie, Makroglossie und Bauchwanddefekt (z. B. Omphalozele/Nabelhernie); zudem neonatale Hypoglykämie.";mittel
17;Genetik/Syndromologie;Warum sind beim Beckwith-Wiedemann-Syndrom regelmäßige Abdomensonographien notwendig?;Wegen des stark erhöhten Tumorrisikos (v. a. Wilms-Tumor, Hepatoblastom) ? Screening bis ca. zum 8. Lebensjahr.;Zur frühzeitigen Erfassung einer biliären Leberzirrhose;Zur Überwachung auf chronisch-entzündliche Darmerkrankungen;Wegen des Risikos für rezidivierende Invaginationen;A;Wegen des stark erhöhten Tumorrisikos (v. a. Wilms-Tumor, Hepatoblastom) ? Screening bis ca. zum 8. Lebensjahr.;mittel
18;Genetik/Syndromologie;Angelman- und Prader-Willi-Syndrom betreffen dieselbe Region (15q11-q13). Wodurch unterscheiden sie sich genetisch?;Angelman durch Mikroduplikation, Prader-Willi durch Deletion;"Angelman-Syndrom: Verlust des maternalen Allels (UBE3A); Prader-Willi-Syndrom: Verlust des paternalen Allels ? Beispiel für genomisches Imprinting.";Angelman gonosomal vererbt, Prader-Willi autosomal-dominant;Angelman FMR1-Gen Mutation, Prader-Willi väterliches UBE3A-Gen;B;"Angelman-Syndrom: Verlust des maternalen Allels (UBE3A); Prader-Willi-Syndrom: Verlust des paternalen Allels ? Beispiel für genomisches Imprinting.";schwer
19;Genetik/Syndromologie;Welche klinischen Merkmale (?Happy-Puppet?) sind für das Angelman-Syndrom typisch?;Schwere Entwicklungsverzögerung mit fehlender Sprache, Ataxie, Lachepisoden/fröhliches Wesen, Epilepsie mit typischen EEG-Veränderungen (parietale Spikes).;Extreme Hyperphagie mit frühkindlicher Adipositas;Progressive Demenz mit spastischer Tetraparese;Normale kognitive Entwicklung mit Innenohrschwerhörigkeit;A;Schwere Entwicklungsverzögerung mit fehlender Sprache, Ataxie, Lachepisoden/fröhliches Wesen, Epilepsie mit typischen EEG-Veränderungen (parietale Spikes).;mittel
20;Genetik/Syndromologie;Wie äußert sich das Prader-Willi-Syndrom im Säuglingsalter und später im Kleinkindalter?;"Säugling: Hypertonie; Kleinkind: extreme Kachexie";"Säugling: Makrosomie; Kleinkind: Diabetes insipidus";"Säuglingsalter: muskuläre Hypotonie und Trinkschwäche/Gedeihstörung; ab ca. 9.?15. Lebensmonat Hyperphagie mit Adipositas; zudem Hypogonadismus und Minderwuchs.";"Säugling: Unauffällig; Kleinkind: progressive Choreoathetose";C;"Säuglingsalter: muskuläre Hypotonie und Trinkschwäche/Gedeihstörung; ab ca. 9.?15. Lebensmonat Hyperphagie mit Adipositas; zudem Hypogonadismus und Minderwuchs.";mittel
21;Stoffwechselstörungen;Welcher Enzymdefekt liegt der klassischen Phenylketonurie (PKU) zugrunde?;Mangel der Phenylalaninhydroxylase (PAH), wodurch Phenylalanin nicht zu Tyrosin abgebaut wird.;Defekt der Galaktose-1-Phosphat-Uridyltransferase;Mangel an Verzweigtketten-Ketosäure-Dehydrogenase;Defekt der Fumarylacetoacetat-Hydrolase (FAH);A;Mangel der Phenylalaninhydroxylase (PAH), wodurch Phenylalanin nicht zu Tyrosin abgebaut wird.;leicht
22;Stoffwechselstörungen;Welcher charakteristische Körper-/Uringeruch wird mit der unbehandelten PKU assoziiert?;Intensiver Geruch nach Ahornsirup oder Maggi-Würze;Mäuseurin-artiger (?modriger?) Geruch durch Phenylketone.;Süßlicher, obstartiger Geruch (Azetongeruch);Strenger Geruch nach faulen Eiern (Schwefelverbindungen);B;Mäuseurin-artiger (?modriger?) Geruch durch Phenylketone.;mittel
23;Stoffwechselstörungen;Wie wird die PKU in Deutschland erfasst und worin besteht die Therapie?;"Erfassung bei U3; kausale Vitamin-B6-Gabe";"Erfassung durch das Neugeborenenscreening; Therapie ist eine lebenslange phenylalaninarme Diät.";Nachweis über pränatale Fruchtwasseruntersuchung;Screening mittels Urinstix bei Einschulung;B;"Erfassung durch das Neugeborenenscreening; Therapie ist eine lebenslange phenylalaninarme Diät.";leicht
24;Stoffwechselstörungen;Welcher Geruch ist für die Ahornsirupkrankheit typisch und welche Stoffwechselgruppe ist betroffen?;"Geruch nach ranziger Butter; Fettsäureabbau betroffen";"Geruch nach Schweißfüßen; Kohlenhydratstoffwechsel betroffen";"Geruch nach Ahornsirup bzw. ?Maggi?; betroffen ist der Abbau der verzweigtkettigen Aminosäuren (Leucin, Isoleucin, Valin) durch Defekt der Verzweigtketten-Ketosäure-Dehydrogenase.";"Geruch nach verfaultem Fisch; Harnstoffzyklus betroffen";C;"Geruch nach Ahornsirup bzw. ?Maggi?; betroffen ist der Abbau der verzweigtkettigen Aminosäuren (Leucin, Isoleucin, Valin) durch Defekt der Verzweigtketten-Ketosäure-Dehydrogenase.";mittel
25;Stoffwechselstörungen;Welcher Enzymdefekt und welches Therapieprinzip kennzeichnen die Tyrosinämie Typ I?;"Defekt der Tyrosinhydroxylase; L-Dopa-Substitution";"Defekt der Homogentisat-Dioxygenase; Ascorbinsäure-Gabe";"Defekt der Fumarylacetoacetat-Hydrolase (FAH) mit Anreicherung von Succinylaceton; Therapie mit NTBC (Nitisinon) plus tyrosin-/phenylalaninarme Diät.";"Defekt der Phenylalaninhydroxylase; Sapropterin-Therapie";C;"Defekt der Fumarylacetoacetat-Hydrolase (FAH) mit Anreicherung von Succinylaceton; Therapie mit NTBC (Nitisinon) plus tyrosin-/phenylalaninarme Diät.";schwer
26;Stoffwechselstörungen;Eine klassische Galaktosämie manifestiert sich nach Beginn der Milchfütterung. Welcher Enzymdefekt liegt vor und welche akute Komplikation droht?;"Defekt der Galaktose-1-Phosphat-Uridyltransferase (GALT); droht akutes Leberversagen, zudem Katarakt und erhöhtes Risiko für E.-coli-Sepsis.";"Defekt der intestinalen Laktase; chronisch-wässrige Diarrhö";"Defekt der Glukose-6-Phosphatase; hyperosmolares Koma";"Defekt der Fruktose-1-phosphat-Aldolase; Hypoglykämie";A;"Defekt der Galaktose-1-Phosphat-Uridyltransferase (GALT); droht akutes Leberversagen, zudem Katarakt und erhöhtes Risiko für E.-coli-Sepsis.";schwer
27;Stoffwechselstörungen;Worin besteht die Therapie der klassischen Galaktosämie?;Lebenslange laktose-/galaktosefreie Ernährung.;Streng fettreduzierte Diät plus Pankreasenzyme;Kontinuierliche nächtliche Zufuhr von Glukose-6-Phosphat;Insulintherapie nach intensiviertem Schema;A;Lebenslange laktose-/galaktosefreie Ernährung.;leicht
28;Stoffwechselstörungen;Welche Stoffwechselgruppe führt klassisch zu einer Hyperammonämie, die als Neugeborenensepsis fehlgedeutet werden kann?;Glykogenosen (z. B. Typ I, von Gierke);Harnstoffzyklusstörungen.;Fettsäureoxidationsdefekte (z. B. MCAD-Mangel);Lysosomale Speichererkrankungen (z. B. Morbus Pompe);B;Harnstoffzyklusstörungen.;mittel
29;Stoffwechselstörungen;Welche Harnstoffzyklusstörung ist die häufigste und welchen Erbgang weist sie auf?;"Der Ornithin-Transcarbamylase-(OTC-)Mangel; Erbgang X-chromosomal.";"Der Argininosuccinat-Lyase-Mangel; autosomal-dominant";"Die klassische Citrullinämie Typ I; autosomal-rezessiv";"Der Carbamoylphosphat-Synthetase-1-Mangel; mitochondrial";A;"Der Ornithin-Transcarbamylase-(OTC-)Mangel; Erbgang X-chromosomal.";schwer
30;Stoffwechselstörungen;Welches Leitsymptom-Muster lässt beim MCAD-Mangel an die Erkrankung denken?;Hypoketotische Hypoglykämie nach längeren Nüchternphasen/Fasten (Fastenintoleranz) durch gestörte Fettsäureoxidation.;Hyperketotische Hyperglykämie nach Fettverzehr;Postprandiale schwere Laktatazidose und Splenomegalie;Chronisch-metabolische Azidose mit hypertoner Dehydration;A;Hypoketotische Hypoglykämie nach längeren Nüchternphasen/Fasten (Fastenintoleranz) durch gestörte Fettsäureoxidation.;schwer
31;Stoffwechselstörungen;Welche allgemeine Akutmaßnahme ist bei Verdacht auf eine metabolische Entgleisung (z. B. Harnstoffzyklusstörung) zentral?;Sofortige Proteingabe zur Verhinderung von Muskelabbau;Stopp der Proteinzufuhr und hochkalorische Glukosezufuhr zur Anabolie (?Katabolie durchbrechen?), ggf. Ammoniaksenkung/Dialyse.;Flüssigkeitsrestriktion und Einleitung einer raschen Kühlung;Hochdosierte intravenöse Aminosäuresubstitution;B;Stopp der Proteinzufuhr und hochkalorische Glukosezufuhr zur Anabolie (?Katabolie durchbrechen?), ggf. Ammoniaksenkung/Dialyse.;mittel
32;Stoffwechselstörungen;Glykogenose Typ I (von Gierke): Welche metabolischen Leitbefunde sind typisch?;Postprandiale Hyperglykämie, Splenomegalie und metabolische Alkalose;Nüchtern-Ketoazidose mit Mikrozephalie und Panzytopenie;Nüchtern-Hypoglykämie, Hepatomegalie, Laktatazidose, Hyperurikämie und Hyperlipidämie (Defekt der Glukose-6-Phosphatase).;Chronische Hypokaliämie mit Pancreatitis und Osteoporose;C;Nüchtern-Hypoglykämie, Hepatomegalie, Laktatazidose, Hyperurikämie und Hyperlipidämie (Defekt der Glukose-6-Phosphatase).;schwer
33;Stoffwechselstörungen;Pompe-Erkrankung (Glykogenose Typ II): Welches Organ steht klinisch im Vordergrund und welcher Enzymdefekt liegt vor?;"Defekt der renalen Glukosidase; Nephrokalzinose im Vordergrund";"Mangel an My phosphorylase; rezidivierende Rhabdomyolyse";"Defekt der lysosomalen sauren ?-Glukosidase; im Vordergrund steht die Kardiomyopathie/Muskelhypotonie (infantile Form).";"Defekt der Galaktokinase; Kataraktbildung isoliert im Vordergrund";C;"Defekt der lysosomalen sauren ?-Glukosidase; im Vordergrund steht die Kardiomyopathie/Muskelhypotonie (infantile Form).";schwer
34;Stoffwechselstörungen;Welche Substanzklasse reichert sich bei den Mukopolysaccharidosen an und welches Leitsymptom ist typisch?;"Sphingolipide; Kirschroter Fleck der Makula und Schwerhörigkeit";"Glykoproteine; progressive Ataxie und chronische Nephritis";"Glykosaminoglykane (saure Mukopolysaccharide); typisch sind grobe Gesichtszüge, Organomegalie, Skelettveränderungen (Dysostosis multiplex) und teils Intelligenzminderung.";"Lipofuszine; frühkindliche Erblindung und spastische Parese";C;"Glykosaminoglykane (saure Mukopolysaccharide); typisch sind grobe Gesichtszüge, Organomegalie, Skelettveränderungen (Dysostosis multiplex) und teils Intelligenzminderung.";mittel
35;Stoffwechselstörungen;Welche Stoffwechselerkrankung sollte bei einem Neugeborenen mit Hepatopathie/Leberversagen und auffälligem Geruch differenzialdiagnostisch immer bedacht werden?;Galaktosämie, Tyrosinämie Typ I sowie Ahornsirupkrankheit (je nach Geruch und Laborkonstellation).;Harnstoffzyklusstörung oder Pyruvatdehydrogenasemangel;MCAD-Mangel oder isolierte Fruktoseintoleranz;Glukose-6-Phosphat-Dehydrogenase-Mangel oder fetale Erythroblastose;A;Galaktosämie, Tyrosinämie Typ I sowie Ahornsirupkrankheit (je nach Geruch und Laborkonstellation).;mittel
36;Stoffwechselstörungen;Was ist das grundlegende Prinzip des erweiterten Neugeborenenscreenings für Stoffwechselerkrankungen?;Routinemäßige genetische Vollsequenzierung am 5. Lebenstag;Erfassung von Antikörpern gegen respiratorische Viren;Vorsorgliche Bestimmung aller Elektrolyte und Leberenzyme per Urinstix;Frühe (präsymptomatische) Erfassung behandelbarer angeborener Störungen aus Trockenblut, u. a. mittels Tandem-Massenspektrometrie.;D;Frühe (präsymptomatische) Erfassung behandelbarer angeborener Störungen aus Trockenblut, u. a. mittels Tandem-Massenspektrometrie.;mittel
37;Diabetologie/Endokrinologie;Welche HbA1c-Schwelle gilt als Diagnosekriterium für einen Diabetes mellitus?;HbA1c ? 5,7 % (? 39 mmol/mol);HbA1c ? 6,0 % (? 42 mmol/mol);HbA1c ? 7,5 % (? 58 mmol/mol);HbA1c ? 6,5 % (? 48 mmol/mol).;D;HbA1c ? 6,5 % (? 48 mmol/mol).;leicht
38;Diabetologie/Endokrinologie;Nennen Sie die klassische Symptomtrias des manifesten Diabetes mellitus Typ 1 im Kindesalter.;Fieber, Erbrechen und akutes Abdomen;Polyurie, Polydipsie und Gewichtsverlust (oft mit Müdigkeit/Leistungsknick).;Kopfschmerzen, Sehstörungen und arterielle Hypertonie;Hämaturie, Ödeme und generalisierte Krampfanfälle;B;Polyurie, Polydipsie und Gewichtsverlust (oft mit Müdigkeit/Leistungsknick).;leicht
39;Diabetologie/Endokrinologie;Welche Laborkonstellation kennzeichnet die diabetische Ketoazidose (DKA)?;Hypoglykämie (<3 mmol/l), respiratorische Alkalose und normale Ketonkörper;Hyperglykämie (>20 mmol/l), metabolische Alkalose und Glukosurie;Hyperglykämie (>11 mmol/l), metabolische Azidose (pH <7,3 bzw. Bikarbonat <15 mmol/l) und Ketonkörper im Blut/Urin.;Normoglykämie, respiratorische Azidose und ausgeprägte Proteinurie;C;Hyperglykämie (>11 mmol/l), metabolische Azidose (pH <7,3 bzw. Bikarbonat <15 mmol/l) und Ketonkörper im Blut/Urin.;mittel
40;Diabetologie/Endokrinologie;Was ist bei der Volumen-/Flüssigkeitstherapie der DKA zu beachten, um eine gefürchtete Komplikation zu vermeiden?;Rascher Bolus von 20 ml/kg hypertoner Kochsalzlösung;Ausschließliche Gabe von freiem Wasser per Magensonde;Langsamer, kontrollierter Flüssigkeits- und Glukoseausgleich, um ein Hirnödem zu vermeiden (kein zu rascher Abfall der Osmolarität).;Gleichzeitige Gabe von hochdosiertem Kalziumgluconat zur Myokardprotektion;C;Langsamer, kontrollierter Flüssigkeits- und Glukoseausgleich, um ein Hirnödem zu vermeiden (kein zu rascher Abfall der Osmolarität).;schwer
41;Diabetologie/Endokrinologie;Welcher Enzymdefekt ist für die häufigste Form des adrenogenitalen Syndroms (AGS) verantwortlich?;Keine Angabe;Keine Angabe;Der 21-Hydroxylase-Mangel.;Keine Angabe;C;Der 21-Hydroxylase-Mangel.;leicht
42;Diabetologie/Endokrinologie;Welche Laborbestimmung dient der Diagnose des klassischen AGS durch 21-Hydroxylase-Mangel?;Keine Angabe;"Erhöhung des 17-Hydroxyprogesterons (17-OHP); im Neugeborenenscreening erfasst.";Keine Angabe;Keine Angabe;B;"Erhöhung des 17-Hydroxyprogesterons (17-OHP); im Neugeborenenscreening erfasst.";mittel
43;Diabetologie/Endokrinologie;Welche akute, lebensbedrohliche Manifestation droht beim AGS mit Salzverlust und wie sieht die Dauertherapie aus?;Keine Angabe;Keine Angabe;Keine Angabe;"Salzverlustkrise (Hyponatriämie, Hyperkaliämie, Hypovolämie, Schock); Dauertherapie mit Hydrocortison plus Fludrocortison (Mineralokortikoid).";D;"Salzverlustkrise (Hyponatriämie, Hyperkaliämie, Hypovolämie, Schock); Dauertherapie mit Hydrocortison plus Fludrocortison (Mineralokortikoid).";schwer
44;Diabetologie/Endokrinologie;Welche endokrine Erkrankung wird durch das TSH-Screening beim Neugeborenen erfasst und warum ist die frühe Therapie entscheidend?;"Die konnatale (kongenitale) Hypothyreose; frühe L-Thyroxin-Therapie verhindert irreversible Intelligenzminderung und Wachstumsstörung.";Keine Angabe;Keine Angabe;Keine Angabe;A;"Die konnatale (kongenitale) Hypothyreose; frühe L-Thyroxin-Therapie verhindert irreversible Intelligenzminderung und Wachstumsstörung.";mittel
45;Diabetologie/Endokrinologie;Womit wird die kongenitale Hypothyreose behandelt?;Keine Angabe;Keine Angabe;Keine Angabe;Mit L-Thyroxin (Levothyroxin), möglichst früh begonnen.;D;Mit L-Thyroxin (Levothyroxin), möglichst früh begonnen.;leicht
46;Diabetologie/Endokrinologie;Ab welchem Perzentilwert spricht man definitionsgemäß von Kleinwuchs?;Wenn die Körperlänge/-höhe unterhalb der 3. Perzentile (bzw. unter -2 SDS) liegt.;Keine Angabe;Keine Angabe;Keine Angabe;A;Wenn die Körperlänge/-höhe unterhalb der 3. Perzentile (bzw. unter -2 SDS) liegt.;mittel
47;Diabetologie/Endokrinologie;Nennen Sie wichtige endokrine bzw. genetische Ursachen eines Kleinwuchses.;Keine Angabe;Wachstumshormonmangel, Hypothyreose, Cushing-Syndrom sowie syndromale Ursachen wie Ullrich-Turner-Syndrom (SHOX-Defekt).;Keine Angabe;Keine Angabe;B;Wachstumshormonmangel, Hypothyreose, Cushing-Syndrom sowie syndromale Ursachen wie Ullrich-Turner-Syndrom (SHOX-Defekt).;mittel
48;Diabetologie/Endokrinologie;Welche Laborparameter werden in der Diagnostik des Wachstumshormonmangels bestimmt und welcher Test ist wegweisend?;IGF-1 (und IGFBP-3) als Screening sowie GH-Stimulationstests (z. B. Insulin-Hypoglykämie-Test, Arginin-/Clonidin-Test).;Keine Angabe;Keine Angabe;Keine Angabe;A;IGF-1 (und IGFBP-3) als Screening sowie GH-Stimulationstests (z. B. Insulin-Hypoglykämie-Test, Arginin-/Clonidin-Test).;schwer
49;Diabetologie/Endokrinologie;Wie unterscheiden sich Diabetes insipidus und SIADH bezüglich Urin und Serumnatrium?;Diabetes insipidus: Polyurie mit verdünntem Urin und Hypernatriämie. SIADH: konzentrierter Urin mit Wasserretention und Hyponatriämie.;Keine Angabe;Keine Angabe;Keine Angabe;A;Diabetes insipidus: Polyurie mit verdünntem Urin und Hypernatriämie. SIADH: konzentrierter Urin mit Wasserretention und Hyponatriämie.;schwer
50;Diabetologie/Endokrinologie;Welche zwei Hauptformen des Diabetes insipidus gibt es?;Keine Angabe;Der zentrale (ADH-/Vasopressinmangel) und der renale (nephrogene, ADH-Resistenz) Diabetes insipidus.;Keine Angabe;Keine Angabe;B;Der zentrale (ADH-/Vasopressinmangel) und der renale (nephrogene, ADH-Resistenz) Diabetes insipidus.;mittel
51;Diabetologie/Endokrinologie;Welcher Vitaminmangel verursacht die klassische Rachitis und welche Befunde sind typisch?;"Vitamin-D-Mangel; typisch sind aufgetriebene Wachstumsfugen (?rachitischer Rosenkranz?), Auftreibungen, Kraniotabes, Hypokalzämie und erhöhte alkalische Phosphatase.";Keine Angabe;Keine Angabe;Keine Angabe;A;"Vitamin-D-Mangel; typisch sind aufgetriebene Wachstumsfugen (?rachitischer Rosenkranz?), Auftreibungen, Kraniotabes, Hypokalzämie und erhöhte alkalische Phosphatase.";mittel
52;Diabetologie/Endokrinologie;Welche Prophylaxe gegen Rachitis erhalten Säuglinge in Deutschland im ersten Lebensjahr?;Keine Angabe;Keine Angabe;Keine Angabe;Tägliche Vitamin-D-Supplementation (Vitamin-D-Prophylaxe).;D;Tägliche Vitamin-D-Supplementation (Vitamin-D-Prophylaxe).;leicht
53;Diabetologie/Endokrinologie;Welche Autoimmunerkrankung ist die häufigste Ursache einer Hyperthyreose im Jugendalter?;Morbus Basedow (Graves-Krankheit) mit TSH-Rezeptor-Antikörpern (TRAK).;Keine Angabe;Keine Angabe;Keine Angabe;A;Morbus Basedow (Graves-Krankheit) mit TSH-Rezeptor-Antikörpern (TRAK).;mittel
54;Diabetologie/Endokrinologie;Was versteht man unter Pubertas praecox und ab welchem Alter gilt sie grob als pathologisch?;Vorzeitiger Pubertätsbeginn ? bei Mädchen vor dem 8., bei Jungen vor dem 9. Lebensjahr.;Keine Angabe;Keine Angabe;Keine Angabe;A;Vorzeitiger Pubertätsbeginn ? bei Mädchen vor dem 8., bei Jungen vor dem 9. Lebensjahr.;mittel
55;Diabetologie/Endokrinologie;Wie unterscheidet man zentrale (GnRH-abhängige) und periphere (GnRH-unabhängige) Pubertas praecox?;Keine Angabe;Keine Angabe;Keine Angabe;Zentrale Form: vorzeitige Aktivierung der Hypothalamus-Hypophysen-Gonaden-Achse (GnRH-abhängig). Periphere Form: gonadale/adrenale Sexualhormonproduktion unabhängig von GnRH (z. B. Tumor, AGS).;D;Zentrale Form: vorzeitige Aktivierung der Hypothalamus-Hypophysen-Gonaden-Achse (GnRH-abhängig). Periphere Form: gonadale/adrenale Sexualhormonproduktion unabhängig von GnRH (z. B. Tumor, AGS).;schwer
56;Diabetologie/Endokrinologie;Welche Therapie wird bei zentraler Pubertas praecox eingesetzt?;Keine Angabe;GnRH-Analoga (Suppression der Gonadotropinausschüttung).;Keine Angabe;Keine Angabe;B;GnRH-Analoga (Suppression der Gonadotropinausschüttung).;mittel
57;Diabetologie/Endokrinologie;Welche autoimmune Thyreoiditis ist die häufigste Ursache einer erworbenen Hypothyreose im Kindes-/Jugendalter?;Keine Angabe;Keine Angabe;Die Hashimoto-Thyreoiditis (Autoantikörper gegen TPO und Thyreoglobulin).;Keine Angabe;C;Die Hashimoto-Thyreoiditis (Autoantikörper gegen TPO und Thyreoglobulin).;mittel
