Nr.;Themengebiet;Frage;Option A;Option B;Option C;Option D;Richtig;Vollständige Antwort;Schwierigkeit
212;Gastroenterologie/Hepatologie;Warum ist die frühe Diagnose der Gallengangsatresie entscheidend?;Weil die operative Korrektur (Kasai-Portoenterostomie) möglichst früh (in den ersten Lebenswochen) erfolgen muss, um eine Leberzirrhose zu verhindern.;Keine Angabe;Keine Angabe;Keine Angabe;A;Weil die operative Korrektur (Kasai-Portoenterostomie) möglichst früh (in den ersten Lebenswochen) erfolgen muss, um eine Leberzirrhose zu verhindern.;schwer
213;Gastroenterologie/Hepatologie;Welche Hepatitisviren werden vorwiegend fäkal-oral übertragen?;Keine Angabe;Keine Angabe;Hepatitis A und Hepatitis E.;Keine Angabe;C;Hepatitis A und Hepatitis E.;mittel
214;Gastroenterologie/Hepatologie;Wie wird Hepatitis B übertragen und welche Prophylaxe steht zur Verfügung?;Keine Angabe;Keine Angabe;"Parenteral, sexuell und vertikal (Mutter-Kind); Prophylaxe durch die Hepatitis-B-Impfung (bei Neugeborenen HBsAg-positiver Mütter zusätzlich Immunglobulin).";Keine Angabe;C;"Parenteral, sexuell und vertikal (Mutter-Kind); Prophylaxe durch die Hepatitis-B-Impfung (bei Neugeborenen HBsAg-positiver Mütter zusätzlich Immunglobulin).";mittel
215;Gastroenterologie/Hepatologie;Was ist die gastroösophageale Refluxkrankheit und womit wird sie medikamentös behandelt?;Keine Angabe;Keine Angabe;"Rückfluss von Mageninhalt mit Beschwerden/Schleimhautschädigung; medikamentös v. a. mit Protonenpumpeninhibitoren (PPI).";Keine Angabe;C;"Rückfluss von Mageninhalt mit Beschwerden/Schleimhautschädigung; medikamentös v. a. mit Protonenpumpeninhibitoren (PPI).";mittel
216;Gastroenterologie/Hepatologie;Welche Stoffwechsel-/Lebererkrankung mit Kupferspeicherung sollte bei Hepatopathie und neurologischen Symptomen bedacht werden?;Keine Angabe;Keine Angabe;Keine Angabe;Der Morbus Wilson.;D;Der Morbus Wilson.;schwer
217;Hämatologie/Onkologie;Welche ist die häufigste Anämieform im Kindesalter und welches Blutbild zeigt sie?;Keine Angabe;Keine Angabe;Keine Angabe;"Die Eisenmangelanämie; mikrozytäre, hypochrome Anämie (MCV und MCH erniedrigt).";D;"Die Eisenmangelanämie; mikrozytäre, hypochrome Anämie (MCV und MCH erniedrigt).";leicht
218;Hämatologie/Onkologie;Welche hereditäre hämolytische Anämie beruht auf einem Defekt der Erythrozytenmembran und zeigt Kugelzellen?;Keine Angabe;Die hereditäre Sphärozytose (Kugelzellanämie).;Keine Angabe;Keine Angabe;B;Die hereditäre Sphärozytose (Kugelzellanämie).;mittel
219;Hämatologie/Onkologie;Welche Hämoglobinopathie führt durch HbS zu sichelförmigen Erythrozyten und vasookklusiven Krisen?;Keine Angabe;Keine Angabe;Keine Angabe;Die Sichelzellkrankheit (Sichelzellanämie).;D;Die Sichelzellkrankheit (Sichelzellanämie).;mittel
220;Hämatologie/Onkologie;Welche Erkrankung beruht auf einer gestörten Synthese der Globinketten mit konsekutiver Anämie?;Keine Angabe;Keine Angabe;Keine Angabe;Die Thalassämie.;D;Die Thalassämie.;mittel
221;Hämatologie/Onkologie;Welcher Enzymdefekt der Erythrozyten kann nach Infekten, bestimmten Medikamenten oder Favabohnen eine akute Hämolyse auslösen?;Der Glucose-6-Phosphat-Dehydrogenase-(G6PD-)Mangel.;Keine Angabe;Keine Angabe;Keine Angabe;A;Der Glucose-6-Phosphat-Dehydrogenase-(G6PD-)Mangel.;schwer
222;Hämatologie/Onkologie;Welche maligne Erkrankung ist die häufigste Krebserkrankung im Kindesalter?;Die akute lymphoblastische Leukämie (ALL).;Keine Angabe;Keine Angabe;Keine Angabe;A;Die akute lymphoblastische Leukämie (ALL).;leicht
223;Hämatologie/Onkologie;Welche klinischen Leitbefunde lassen an eine akute Leukämie denken?;Keine Angabe;Zeichen der Knochenmarkverdrängung: Anämie (Blässe/Müdigkeit), Thrombozytopenie (Blutungen/Petechien) und Neutropenie (Infekte/Fieber), oft mit Knochenschmerzen und Hepatosplenomegalie/Lymphadenopathie.;Keine Angabe;Keine Angabe;B;Zeichen der Knochenmarkverdrängung: Anämie (Blässe/Müdigkeit), Thrombozytopenie (Blutungen/Petechien) und Neutropenie (Infekte/Fieber), oft mit Knochenschmerzen und Hepatosplenomegalie/Lymphadenopathie.;mittel
224;Hämatologie/Onkologie;Welcher solide Tumor ist der häufigste extrakranielle solide Tumor des Kindesalters und entsteht aus dem sympathischen Nervengewebe?;Keine Angabe;Keine Angabe;Keine Angabe;Das Neuroblastom.;D;Das Neuroblastom.;mittel
225;Hämatologie/Onkologie;Welche Tumormarker sind beim Neuroblastom typischerweise erhöht?;Keine Angabe;Katecholaminmetabolite, v. a. Homovanillinsäure (HVA) und Vanillinmandelsäure (VMA) im Urin.;Keine Angabe;Keine Angabe;B;Katecholaminmetabolite, v. a. Homovanillinsäure (HVA) und Vanillinmandelsäure (VMA) im Urin.;schwer
226;Hämatologie/Onkologie;Welcher genetische Marker ist beim Neuroblastom prognostisch ungünstig?;Die Amplifikation des MYCN-Onkogens.;Keine Angabe;Keine Angabe;Keine Angabe;A;Die Amplifikation des MYCN-Onkogens.;schwer
227;Hämatologie/Onkologie;Welcher Tumor ist der häufigste maligne Nierentumor des Kindesalters?;Keine Angabe;Das Nephroblastom (Wilms-Tumor).;Keine Angabe;Keine Angabe;B;Das Nephroblastom (Wilms-Tumor).;mittel
228;Hämatologie/Onkologie;Welche Vorsichtsregel gilt bei der Untersuchung/Operation eines Wilms-Tumors?;Keine Angabe;Vorsichtige Palpation und sorgfältige Operation zur Vermeidung einer Tumorruptur (Gefahr der Tumorzellaussaat).;Keine Angabe;Keine Angabe;B;Vorsichtige Palpation und sorgfältige Operation zur Vermeidung einer Tumorruptur (Gefahr der Tumorzellaussaat).;schwer
229;Hämatologie/Onkologie;Welche Tumoren sind die häufigsten soliden Tumoren des Kindesalters insgesamt?;Keine Angabe;Die Hirntumoren (ZNS-Tumoren).;Keine Angabe;Keine Angabe;B;Die Hirntumoren (ZNS-Tumoren).;mittel
230;Hämatologie/Onkologie;Welcher bösartige Hirntumor ist im Kindesalter am häufigsten und wo ist er typischerweise lokalisiert?;Das Medulloblastom, typischerweise infratentoriell (Kleinhirn/4. Ventrikel).;Keine Angabe;Keine Angabe;Keine Angabe;A;Das Medulloblastom, typischerweise infratentoriell (Kleinhirn/4. Ventrikel).;schwer
231;Hämatologie/Onkologie;Welcher primäre maligne Knochentumor ist im Kindes-/Jugendalter am häufigsten und wo tritt er bevorzugt auf?;Keine Angabe;Keine Angabe;Keine Angabe;Das Osteosarkom, bevorzugt an der distalen Femurmetaphyse (kniegelenksnah).;D;Das Osteosarkom, bevorzugt an der distalen Femurmetaphyse (kniegelenksnah).;mittel
232;Hämatologie/Onkologie;Welcher Knochentumor ist der zweithäufigste und im Gegensatz zum Osteosarkom strahlensensibel?;Das Ewing-Sarkom.;Keine Angabe;Keine Angabe;Keine Angabe;A;Das Ewing-Sarkom.;schwer
233;Hämatologie/Onkologie;Welches Weichteilsarkom ist im Kindesalter am häufigsten?;Keine Angabe;Das Rhabdomyosarkom.;Keine Angabe;Keine Angabe;B;Das Rhabdomyosarkom.;mittel
234;Hämatologie/Onkologie;Welcher Augentumor des Kleinkindes fällt häufig durch eine weiße Pupille (Leukokorie) auf?;Keine Angabe;Das Retinoblastom.;Keine Angabe;Keine Angabe;B;Das Retinoblastom.;mittel
235;Hämatologie/Onkologie;Welche maligne Lymphomerkrankung mit Reed-Sternberg-Zellen tritt v. a. im Jugendalter auf?;Keine Angabe;Keine Angabe;Das Hodgkin-Lymphom.;Keine Angabe;C;Das Hodgkin-Lymphom.;mittel
236;Hämatologie/Onkologie;Welche akute lebensbedrohliche Stoffwechselkomplikation kann zu Beginn der Chemotherapie bei großer Tumorlast auftreten?;Keine Angabe;Das Tumorlysesyndrom (Hyperkaliämie, Hyperphosphatämie, Hyperurikämie, Hypokalzämie).;Keine Angabe;Keine Angabe;B;Das Tumorlysesyndrom (Hyperkaliämie, Hyperphosphatämie, Hyperurikämie, Hypokalzämie).;schwer
237;Hämostaseologie;Welcher Gerinnungsfaktor fehlt bei der Hämophilie A und welcher bei der Hämophilie B?;Keine Angabe;"Hämophilie A: Faktor VIII; Hämophilie B: Faktor IX.";Keine Angabe;Keine Angabe;B;"Hämophilie A: Faktor VIII; Hämophilie B: Faktor IX.";leicht
238;Hämostaseologie;Welcher Erbgang liegt der Hämophilie A und B zugrunde?;Keine Angabe;Keine Angabe;X-chromosomal-rezessiv (überwiegend Jungen betroffen, Mütter sind Konduktorinnen).;Keine Angabe;C;X-chromosomal-rezessiv (überwiegend Jungen betroffen, Mütter sind Konduktorinnen).;mittel
239;Hämostaseologie;Welcher Globaltest der plasmatischen Gerinnung ist bei Hämophilie typischerweise verlängert?;Die aktivierte partielle Thromboplastinzeit (aPTT).;Keine Angabe;Keine Angabe;Keine Angabe;A;Die aktivierte partielle Thromboplastinzeit (aPTT).;mittel
240;Hämostaseologie;Welche Blutungsart ist für die Hämophilie besonders typisch?;Gelenkeinblutungen (Hämarthros) und Muskelblutungen, mit Gefahr der Hämophilie-Arthropathie.;Keine Angabe;Keine Angabe;Keine Angabe;A;Gelenkeinblutungen (Hämarthros) und Muskelblutungen, mit Gefahr der Hämophilie-Arthropathie.;mittel
241;Hämostaseologie;Womit wird eine schwere Hämophilie A behandelt?;Keine Angabe;Durch Substitution des fehlenden Gerinnungsfaktors (Faktor-VIII-Konzentrat), prophylaktisch oder bei Blutung.;Keine Angabe;Keine Angabe;B;Durch Substitution des fehlenden Gerinnungsfaktors (Faktor-VIII-Konzentrat), prophylaktisch oder bei Blutung.;mittel
242;Hämostaseologie;Welches Medikament kann bei milder Hämophilie A oder Von-Willebrand-Erkrankung eingesetzt werden, weil es gespeicherten von-Willebrand-Faktor/Faktor VIII freisetzt?;Keine Angabe;Keine Angabe;Keine Angabe;DDAVP (Desmopressin).;D;DDAVP (Desmopressin).;schwer
243;Hämostaseologie;Welche ist die häufigste angeborene Blutungsneigung und welche Blutungsart ist typisch?;"Das Von-Willebrand-Syndrom; typisch sind Schleimhaut-/Hautblutungen (z. B. Nasenbluten, Menorrhagie).";Keine Angabe;Keine Angabe;Keine Angabe;A;"Das Von-Willebrand-Syndrom; typisch sind Schleimhaut-/Hautblutungen (z. B. Nasenbluten, Menorrhagie).";mittel
244;Hämostaseologie;Welche erworbene Erkrankung verursacht eine isolierte Thrombozytopenie mit Petechien, oft nach einem viralen Infekt?;Keine Angabe;Keine Angabe;Keine Angabe;Die Immunthrombozytopenie (ITP).;D;Die Immunthrombozytopenie (ITP).;mittel
245;Hämostaseologie;Welche Trias an Blutungszeichen (Schleimhautblutung, Petechien, ...) spricht für eine Thrombozytopenie/Thrombozytopathie statt für eine plasmatische Gerinnungsstörung?;Keine Angabe;Keine Angabe;Schleimhautblutungen, petechiale Hautblutungen und verlängerte Blutungszeit (im Gegensatz zu tiefen Gelenk-/Muskelblutungen bei plasmatischer Störung).;Keine Angabe;C;Schleimhautblutungen, petechiale Hautblutungen und verlängerte Blutungszeit (im Gegensatz zu tiefen Gelenk-/Muskelblutungen bei plasmatischer Störung).;schwer
246;Hämostaseologie;Welche erworbene Verbrauchskoagulopathie tritt z. B. bei Sepsis auf und verbraucht Gerinnungsfaktoren und Thrombozyten?;Keine Angabe;Die disseminierte intravasale Gerinnung (DIC, Verbrauchskoagulopathie).;Keine Angabe;Keine Angabe;B;Die disseminierte intravasale Gerinnung (DIC, Verbrauchskoagulopathie).;schwer
247;Hämostaseologie;Welche Blutung droht beim Neugeborenen ohne Vitamin-K-Prophylaxe?;Keine Angabe;Keine Angabe;Die Vitamin-K-Mangelblutung (Morbus haemorrhagicus neonatorum), u. a. mit Gefahr der Hirnblutung.;Keine Angabe;C;Die Vitamin-K-Mangelblutung (Morbus haemorrhagicus neonatorum), u. a. mit Gefahr der Hirnblutung.;mittel
248;Hämostaseologie;Welches Medikament hemmt die Fibrinolyse und wird unterstützend bei Schleimhautblutungen eingesetzt?;Tranexamsäure (Antifibrinolytikum).;Keine Angabe;Keine Angabe;Keine Angabe;A;Tranexamsäure (Antifibrinolytikum).;mittel
249;Nephrologie;Wie ist das nephrotische Syndrom laborchemisch definiert?;Keine Angabe;Keine Angabe;Große Proteinurie (>1000 mg/mř KOF/Tag bzw. >40 mg/mř/h), Hypoalbuminämie (?25 g/l), Ödeme und Hyperlipidämie.;Keine Angabe;C;Große Proteinurie (>1000 mg/mř KOF/Tag bzw. >40 mg/mř/h), Hypoalbuminämie (?25 g/l), Ödeme und Hyperlipidämie.;schwer
250;Nephrologie;Welche histologische Form liegt dem idiopathischen nephrotischen Syndrom im Kindesalter am häufigsten zugrunde?;Keine Angabe;Keine Angabe;Keine Angabe;Die Minimal-Change-Glomerulopathie (Minimal-Change-Nephrose).;D;Die Minimal-Change-Glomerulopathie (Minimal-Change-Nephrose).;mittel
251;Nephrologie;Wie wird das idiopathische nephrotische Syndrom (Erstmanifestation) initial behandelt?;Keine Angabe;Keine Angabe;Keine Angabe;"Mit Glukokortikoiden (Prednison/Prednisolon); die meisten Kinder zwischen 1 und 10 Jahren sind steroidsensibel.";D;"Mit Glukokortikoiden (Prednison/Prednisolon); die meisten Kinder zwischen 1 und 10 Jahren sind steroidsensibel.";mittel
252;Nephrologie;Wie definiert man ein steroidresistentes nephrotisches Syndrom?;Keine Angabe;Keine Angabe;"Keine Remission unter standardisierter Steroidtherapie; dann sind Nierenbiopsie und/oder genetische Diagnostik indiziert.";Keine Angabe;C;"Keine Remission unter standardisierter Steroidtherapie; dann sind Nierenbiopsie und/oder genetische Diagnostik indiziert.";schwer
253;Nephrologie;Welche Erkrankung tritt typischerweise 1?3 Wochen nach einer Streptokokkeninfektion auf und zeigt Hämaturie, Ödeme und Hypertonie?;Keine Angabe;Keine Angabe;Die akute postinfektiöse (Poststreptokokken-)Glomerulonephritis.;Keine Angabe;C;Die akute postinfektiöse (Poststreptokokken-)Glomerulonephritis.;mittel
254;Nephrologie;Welcher Komplementwert ist bei der akuten Poststreptokokken-Glomerulonephritis typischerweise erniedrigt?;Das Komplement C3 (passager erniedrigt).;Keine Angabe;Keine Angabe;Keine Angabe;A;Das Komplement C3 (passager erniedrigt).;schwer
255;Nephrologie;Welche Trias kennzeichnet das hämolytisch-urämische Syndrom (HUS)?;Keine Angabe;Keine Angabe;Keine Angabe;Mikroangiopathische hämolytische Anämie, Thrombozytopenie und akutes Nierenversagen.;D;Mikroangiopathische hämolytische Anämie, Thrombozytopenie und akutes Nierenversagen.;schwer
256;Nephrologie;Welcher Erreger/Toxin ist die häufigste Ursache des typischen (D+) HUS im Kindesalter?;Keine Angabe;Enterohämorrhagische E. coli (EHEC), die Shiga-Toxin/Verotoxin bilden ? oft nach blutiger Diarrhö.;Keine Angabe;Keine Angabe;B;Enterohämorrhagische E. coli (EHEC), die Shiga-Toxin/Verotoxin bilden ? oft nach blutiger Diarrhö.;schwer
257;Nephrologie;Was ist der vesikoureterale Reflux (VUR) und welche Folge droht?;Keine Angabe;Keine Angabe;Keine Angabe;"Rückfluss von Urin aus der Blase in den Harnleiter/das Nierenbecken; Folge sind rezidivierende Harnwegsinfekte mit Gefahr der Nierennarbenbildung (Refluxnephropathie).";D;"Rückfluss von Urin aus der Blase in den Harnleiter/das Nierenbecken; Folge sind rezidivierende Harnwegsinfekte mit Gefahr der Nierennarbenbildung (Refluxnephropathie).";mittel
258;Nephrologie;Welche Prophylaxe wird bei höhergradigem VUR häufig eingesetzt?;Eine antibakterielle Langzeitprophylaxe (low-dose) zum Schutz vor Pyelonephritiden.;Keine Angabe;Keine Angabe;Keine Angabe;A;Eine antibakterielle Langzeitprophylaxe (low-dose) zum Schutz vor Pyelonephritiden.;mittel
259;Nephrologie;Welche klassische Symptomtrias spricht für eine Pyelonephritis (obere Harnwegsinfektion)?;Keine Angabe;Fieber, Flankenschmerz und allgemeines Krankheitsgefühl (mit Bakteriurie/Leukozyturie).;Keine Angabe;Keine Angabe;B;Fieber, Flankenschmerz und allgemeines Krankheitsgefühl (mit Bakteriurie/Leukozyturie).;mittel
260;Nephrologie;Welcher Erreger verursacht am häufigsten einen Harnwegsinfekt im Kindesalter?;Keine Angabe;Keine Angabe;Escherichia coli.;Keine Angabe;C;Escherichia coli.;leicht
261;Nephrologie;Wie unterscheidet man eine Mikrohämaturie von einer Makrohämaturie?;"Mikrohämaturie ist nur mikroskopisch/per Teststreifen nachweisbar; bei Makrohämaturie ist der Urin sichtbar rot/braun verfärbt.";Keine Angabe;Keine Angabe;Keine Angabe;A;"Mikrohämaturie ist nur mikroskopisch/per Teststreifen nachweisbar; bei Makrohämaturie ist der Urin sichtbar rot/braun verfärbt.";leicht
262;Nephrologie;Welche Hinweise sprechen eher für eine glomeruläre Hämaturie?;Keine Angabe;Keine Angabe;Keine Angabe;Brauner/cola-farbener Urin, dysmorphe Erythrozyten und Erythrozytenzylinder, oft mit Proteinurie und Hypertonie.;D;Brauner/cola-farbener Urin, dysmorphe Erythrozyten und Erythrozytenzylinder, oft mit Proteinurie und Hypertonie.;schwer
263;Nephrologie;Was versteht man unter primärer Enuresis nocturna?;Keine Angabe;Keine Angabe;Keine Angabe;Nächtliches Einnässen jenseits des 5. Lebensjahres ohne dass das Kind zuvor länger (?6 Monate) trocken war.;D;Nächtliches Einnässen jenseits des 5. Lebensjahres ohne dass das Kind zuvor länger (?6 Monate) trocken war.;mittel
264;Nephrologie;Welche nicht-medikamentöse Therapie ist bei der monosymptomatischen Enuresis nocturna wirksam?;Die apparative Verhaltenstherapie mit Klingelhose/Weckapparat (?AEC/Klingelmatte?).;Keine Angabe;Keine Angabe;Keine Angabe;A;Die apparative Verhaltenstherapie mit Klingelhose/Weckapparat (?AEC/Klingelmatte?).;mittel
265;Nephrologie;Welches Medikament kann kurzfristig (z. B. für Übernachtungen) bei Enuresis nocturna eingesetzt werden?;Keine Angabe;Keine Angabe;Keine Angabe;Desmopressin (DDAVP).;D;Desmopressin (DDAVP).;mittel
266;Nephrologie;Wie ist ein akutes Nierenversagen grundsätzlich gekennzeichnet?;Keine Angabe;Keine Angabe;Durch einen raschen Abfall der Nierenfunktion (Anstieg von Kreatinin/Harnstoff), oft mit Oligurie/Anurie und Störungen des Wasser-, Elektrolyt- und Säure-Basen-Haushalts.;Keine Angabe;C;Durch einen raschen Abfall der Nierenfunktion (Anstieg von Kreatinin/Harnstoff), oft mit Oligurie/Anurie und Störungen des Wasser-, Elektrolyt- und Säure-Basen-Haushalts.;mittel
267;Orthopädie;Welches bildgebende Verfahren ist beim Säugling Standard zur Erkennung der Hüftdysplasie und nach welcher Klassifikation wird es beurteilt?;Die Hüftsonographie (im Rahmen der U3), beurteilt nach der Graf-Klassifikation.;Keine Angabe;Keine Angabe;Keine Angabe;A;Die Hüftsonographie (im Rahmen der U3), beurteilt nach der Graf-Klassifikation.;mittel
268;Orthopädie;Wie wird eine Hüftdysplasie/-luxation im Säuglingsalter typischerweise konservativ behandelt?;Keine Angabe;Keine Angabe;Durch Spreiz-/Beugebehandlung (Spreizhose, Beugeschiene), je nach Graf-Stadium ggf. Reposition und Retention.;Keine Angabe;C;Durch Spreiz-/Beugebehandlung (Spreizhose, Beugeschiene), je nach Graf-Stadium ggf. Reposition und Retention.;mittel
269;Orthopädie;Was ist der Morbus Perthes?;Keine Angabe;Keine Angabe;Keine Angabe;Eine idiopathische avaskuläre Nekrose des Femurkopfes (Hüftkopfnekrose) im Kindesalter.;D;Eine idiopathische avaskuläre Nekrose des Femurkopfes (Hüftkopfnekrose) im Kindesalter.;mittel
270;Orthopädie;Wie äußert sich der Morbus Perthes klinisch?;Hinken und Hüft- oder (projizierter) Knieschmerz, oft bei Jungen im Alter von ca. 4?8 Jahren, mit Bewegungseinschränkung.;Keine Angabe;Keine Angabe;Keine Angabe;A;Hinken und Hüft- oder (projizierter) Knieschmerz, oft bei Jungen im Alter von ca. 4?8 Jahren, mit Bewegungseinschränkung.;mittel
271;Orthopädie;Welche Hüfterkrankung des (übergewichtigen) Jugendlichen ist ein Notfall und beruht auf einem Abrutschen der Femurkopfepiphyse?;Keine Angabe;Keine Angabe;Keine Angabe;Die Epiphyseolysis capitis femoris (ECF).;D;Die Epiphyseolysis capitis femoris (ECF).;schwer
272;Orthopädie;Warum ist die instabile Epiphyseolysis capitis femoris ein Notfall?;Keine Angabe;Keine Angabe;Keine Angabe;"Wegen der Gefahr der Hüftkopfnekrose; sie erfordert rasche operative Fixierung (Verschraubung).";D;"Wegen der Gefahr der Hüftkopfnekrose; sie erfordert rasche operative Fixierung (Verschraubung).";schwer
273;Orthopädie;Welche häufige, meist transiente Hüftaffektion nach einem Infekt führt zu Hinken und Hüftschmerz mit Gelenkerguss in der Sonographie?;Keine Angabe;Keine Angabe;Keine Angabe;Die Coxitis fugax (?Hüftschnupfen?, transiente Synovitis).;D;Die Coxitis fugax (?Hüftschnupfen?, transiente Synovitis).;mittel
274;Orthopädie;Welche wichtige Differenzialdiagnose der Coxitis fugax muss bei Fieber und schlechtem Allgemeinzustand ausgeschlossen werden?;Die septische (bakterielle) Koxitis/Arthritis bzw. Osteomyelitis.;Keine Angabe;Keine Angabe;Keine Angabe;A;Die septische (bakterielle) Koxitis/Arthritis bzw. Osteomyelitis.;mittel
275;Orthopädie;Welche Erkrankung verursacht beim sportlich aktiven Jugendlichen Schmerzen an der Tuberositas tibiae?;Der Morbus Osgood-Schlatter (Apophysitis der Tuberositas tibiae).;Keine Angabe;Keine Angabe;Keine Angabe;A;Der Morbus Osgood-Schlatter (Apophysitis der Tuberositas tibiae).;mittel
276;Orthopädie;Welche angeborene Fußfehlstellung wird heute überwiegend mit der Ponseti-Methode (Gipsredression) behandelt?;Keine Angabe;Der kongenitale Klumpfuß (Pes equinovarus).;Keine Angabe;Keine Angabe;B;Der kongenitale Klumpfuß (Pes equinovarus).;mittel
277;Orthopädie;Was versteht man unter einer Skoliose?;Keine Angabe;Eine fixierte seitliche Verbiegung der Wirbelsäule mit Rotation der Wirbelkörper.;Keine Angabe;Keine Angabe;B;Eine fixierte seitliche Verbiegung der Wirbelsäule mit Rotation der Wirbelkörper.;leicht
278;Orthopädie;Welche Erkrankung sollte bei Knochenschmerz, lokaler Schwellung und Fieber differenzialdiagnostisch immer bedacht werden?;Die (akute) Osteomyelitis.;Keine Angabe;Keine Angabe;Keine Angabe;A;Die (akute) Osteomyelitis.;mittel
279;Orthopädie;Welcher Erreger verursacht am häufigsten eine hämatogene Osteomyelitis im Kindesalter?;Keine Angabe;Staphylococcus aureus.;Keine Angabe;Keine Angabe;B;Staphylococcus aureus.;mittel
280;Orthopädie;Wie ist das grundlegende Vorgehen bei einem hinkenden Kind mit Hüftschmerz (diagnostischer Erstschritt)?;"Klinische Untersuchung plus Hüftsonographie (Frage nach Gelenkerguss), Entzündungsparameter und ggf. Röntgen; Ausschluss von septischer Arthritis, Coxitis fugax, Perthes und ECF.";Keine Angabe;Keine Angabe;Keine Angabe;A;"Klinische Untersuchung plus Hüftsonographie (Frage nach Gelenkerguss), Entzündungsparameter und ggf. Röntgen; Ausschluss von septischer Arthritis, Coxitis fugax, Perthes und ECF.";mittel
281;Dermatologie;Welche bakterielle Hautinfektion zeigt typische honiggelbe Krusten und wird durch Staphylokokken/Streptokokken verursacht?;Die Erysipel;Die Impetigo contagiosa.;Die Tinea corporis;Die Follikulitis;B;Die Impetigo contagiosa.;leicht
282;Dermatologie;Welches Virus verursacht die Hand-Fuß-Mund-Krankheit?;Parvovirus B19;Varizella-Zoster-Virus;Herpes-simplex-Virus Typ 1;"Coxsackie-Viren (v. a. Coxsackie A16; auch A6).";D;"Coxsackie-Viren (v. a. Coxsackie A16; auch A6).";mittel
283;Dermatologie;Welche chronische, schubweise verlaufende juckende Hauterkrankung mit altersabhängiger Verteilung und Atopie-Assoziation ist gemeint?;Die Psoriasis vulgaris;Das atopische Ekzem (Neurodermitis, atopische Dermatitis).;Die Urtikaria;Die seborrhoische Dermatitis;B;Das atopische Ekzem (Neurodermitis, atopische Dermatitis).;leicht
284;Dermatologie;Worauf beruht die Basistherapie des atopischen Ekzems?;Auf konsequenter rückfettender Hautpflege (Emollientien) zur Wiederherstellung der Hautbarriere.;Auf konsequenter Meidung aller Nahrungsmittelallergene;Auf täglicher Ganzkörperdesinfektion zur Keimreduktion;Auf regelmäßiger Anwendung topischer Glukokortikoide;A;Auf konsequenter rückfettender Hautpflege (Emollientien) zur Wiederherstellung der Hautbarriere.;mittel
285;Dermatologie;Welche Wirkstoffe werden bei akuten Schüben des atopischen Ekzems topisch eingesetzt?;Topische Glukokortikoide (alternativ topische Calcineurininhibitoren wie Tacrolimus/Pimecrolimus).;Topische Antimykotika;Topische Antibiotika (z. B. Fusidinsäure);Systemische Antihistaminika;A;Topische Glukokortikoide (alternativ topische Calcineurininhibitoren wie Tacrolimus/Pimecrolimus).;mittel
286;Dermatologie;Welche Parasitose verursacht starken (v. a. nächtlichen) Juckreiz mit typischen Milbengängen und erfordert Mitbehandlung aller Kontaktpersonen?;Die Larva migrans cutanea;Die Pedikulose (Kopflausbefall);Die Tinea pedis;Die Skabies (Krätze, Sarcoptes scabiei).;D;Die Skabies (Krätze, Sarcoptes scabiei).;mittel
287;Dermatologie;Welche häufige Hautirritation im Windelbereich entsteht durch Feuchtigkeit/Reibung und kann durch Candida superinfiziert werden?;Die perianale Streptokokkendermatitis;Die infantile seborrhoische Dermatitis;Die Windeldermatitis.;Die Intertrigo;C;Die Windeldermatitis.;leicht
288;Dermatologie;Welche Erkrankung verursacht scharf begrenzte, silbrig schuppende erythematöse Plaques (z. B. an Streckseiten und Kopfhaut)?;Der Lichen planus;Das atopische Ekzem;Die Pityriasis rosea;Die Psoriasis (Schuppenflechte).;D;Die Psoriasis (Schuppenflechte).;mittel
289;Dermatologie;Welche Hauterkrankung des Jugendalters entsteht durch Verhornungsstörung und Entzündung der Talgdrüsenfollikel?;Die periorale Dermatitis;Die Akne vulgaris.;Die seborrhoische Dermatitis;Die Rosazea;B;Die Akne vulgaris.;leicht
290;Dermatologie;Welche häufigen gutartigen Gefäßtumoren des Säuglings wachsen zunächst und bilden sich danach meist spontan zurück?;Port-Wine-Stains (Naevus flammeus);Kongenitale melanozytäre Nävi;Kavernöse Lymphangiome;Infantile Hämangiome.;D;Infantile Hämangiome.;mittel
291;Dermatologie;Welches Medikament ist Mittel der Wahl bei behandlungsbedürftigen (komplizierten) infantilen Hämangiomen?;Imiquimod (topischer Immunmodulator);Propranolol (systemischer Betablocker).;Vincristin (Chemotherapeutikum);Prednisolon (systemisches Kortikosteroid);B;Propranolol (systemischer Betablocker).;schwer
292;Dermatologie;Welche viral verursachten, zentral gedellten Hautpapeln treten gehäuft bei Kindern mit atopischem Ekzem auf?;Verrucae vulgares (Stachelwarzen);Milien;Herpes-simplex-Effloreszenzen;Mollusca contagiosa (Dellwarzen).;D;Mollusca contagiosa (Dellwarzen).;mittel
293;Dermatologie;Welche Pilzinfektion der Haut zeigt randbetonte, schuppende, zentral abblassende Herde?;Das nummuläre Ekzem;Die Pityriasis versicolor;Die Vitiligo;Die Tinea (Dermatophytose, z. B. Tinea corporis).;D;Die Tinea (Dermatophytose, z. B. Tinea corporis).;mittel
