Nr.;Themengebiet;Frage;Option A;Option B;Option C;Option D;Richtig;Vollständige Antwort;Schwierigkeit
137;Infektiologie;Welcher Erreger verursacht Scharlach und welches Antibiotikum ist Mittel der Wahl?;"Streptococcus pyogenes (Gruppe-A-Streptokokken); Mittel der Wahl ist Penicillin V.";Keine Angabe;Keine Angabe;Keine Angabe;A;"Streptococcus pyogenes (Gruppe-A-Streptokokken); Mittel der Wahl ist Penicillin V.";mittel
138;Infektiologie;Nennen Sie typische klinische Zeichen des Scharlachs.;Keine Angabe;Keine Angabe;Keine Angabe;Fieber, Tonsillopharyngitis, kleinfleckiges Exanthem mit periorale Blässe, Erdbeer-/Himbeerzunge und spätere Schuppung.;D;Fieber, Tonsillopharyngitis, kleinfleckiges Exanthem mit periorale Blässe, Erdbeer-/Himbeerzunge und spätere Schuppung.;mittel
139;Infektiologie;Welche gefürchteten Folgeerkrankungen können nach einer Streptokokken-Angina/Scharlach auftreten?;Keine Angabe;Keine Angabe;Akutes rheumatisches Fieber und die Poststreptokokken-Glomerulonephritis.;Keine Angabe;C;Akutes rheumatisches Fieber und die Poststreptokokken-Glomerulonephritis.;mittel
140;Infektiologie;Welcher Erreger verursacht die Lyme-Borreliose und welches Hautzeichen ist im Frühstadium typisch?;Keine Angabe;"Borrelia burgdorferi (übertragen durch Zecken); typisch ist das Erythema migrans (Wanderröte).";Keine Angabe;Keine Angabe;B;"Borrelia burgdorferi (übertragen durch Zecken); typisch ist das Erythema migrans (Wanderröte).";mittel
141;Infektiologie;Welches Antibiotikum wird bei Lyme-Borreliose im Kindesalter typischerweise eingesetzt?;Keine Angabe;Amoxicillin (bei jüngeren Kindern) bzw. Doxycyclin (ab 9 Jahren), je nach Stadium auch Ceftriaxon.;Keine Angabe;Keine Angabe;B;Amoxicillin (bei jüngeren Kindern) bzw. Doxycyclin (ab 9 Jahren), je nach Stadium auch Ceftriaxon.;mittel
142;Infektiologie;Welcher Erreger verursacht die Tuberkulose und mit welcher Standard-Kombinationstherapie wird behandelt?;Keine Angabe;Keine Angabe;Keine Angabe;"Mycobacterium tuberculosis; Standardtherapie mit Isoniazid, Rifampicin, Pyrazinamid und Ethambutol.";D;"Mycobacterium tuberculosis; Standardtherapie mit Isoniazid, Rifampicin, Pyrazinamid und Ethambutol.";schwer
143;Infektiologie;Welcher Test wird zur immunologischen Tuberkulose-Diagnostik eingesetzt (neben dem Tuberkulin-Hauttest)?;Keine Angabe;Keine Angabe;Der Interferon-Gamma-Release-Assay (IGRA).;Keine Angabe;C;Der Interferon-Gamma-Release-Assay (IGRA).;schwer
144;Infektiologie;Welches Virostatikum ist Mittel der Wahl bei schwerer Varizellen- oder Herpes-simplex-Infektion?;Keine Angabe;Keine Angabe;Aciclovir.;Keine Angabe;C;Aciclovir.;leicht
145;Infektiologie;Wie wird die HIV-Infektion bei Kindern überwiegend erworben und wodurch lässt sich die vertikale Transmission deutlich senken?;"Überwiegend vertikal (Mutter-Kind); durch antiretrovirale Therapie der Mutter, Sectio bei hoher Viruslast und Verzicht auf Stillen lässt sich die Übertragung stark reduzieren.";Keine Angabe;Keine Angabe;Keine Angabe;A;"Überwiegend vertikal (Mutter-Kind); durch antiretrovirale Therapie der Mutter, Sectio bei hoher Viruslast und Verzicht auf Stillen lässt sich die Übertragung stark reduzieren.";schwer
146;Infektiologie;Welche Impfungen sind als Lebendimpfstoffe bei Immunsuppression bzw. in der Schwangerschaft kontraindiziert?;Keine Angabe;MMR und Varizellen (Lebendimpfstoffe).;Keine Angabe;Keine Angabe;B;MMR und Varizellen (Lebendimpfstoffe).;mittel
147;Infektiologie;In welchem Alter werden laut STIKO die beiden MMR-Impfungen im Säuglings-/Kleinkindalter empfohlen?;Keine Angabe;Keine Angabe;Keine Angabe;Die erste MMR-Impfung im Alter von 11?14 Monaten, die zweite mit 15?23 Monaten.;D;Die erste MMR-Impfung im Alter von 11?14 Monaten, die zweite mit 15?23 Monaten.;schwer
148;Infektiologie;Welche grundsätzliche Vorsichtsregel gilt für die Antibiotikatherapie bei Fieber in der Granulozytopenie (Neutropenie)?;Keine Angabe;Keine Angabe;Fieber bei Neutropenie ist ein Notfall ? sofortige empirische breite (z. B. Pseudomonas-wirksame) antibiotische Therapie nach Abnahme von Blutkulturen.;Keine Angabe;C;Fieber bei Neutropenie ist ein Notfall ? sofortige empirische breite (z. B. Pseudomonas-wirksame) antibiotische Therapie nach Abnahme von Blutkulturen.;mittel
149;Infektiologie;Welches Virus verursacht das Exanthema subitum (Dreitagefieber)?;Humanes Herpesvirus 6 (HHV-6).;Keine Angabe;Keine Angabe;Keine Angabe;A;Humanes Herpesvirus 6 (HHV-6).;mittel
150;Infektiologie;Welcher Erreger verursacht Ringelröteln (Erythema infectiosum) und welche Komplikation droht bei Schwangeren/Anämiepatienten?;Keine Angabe;Keine Angabe;"Parvovirus B19; Komplikationen sind aplastische Krise (bei hämolytischer Anämie) und Hydrops fetalis in der Schwangerschaft.";Keine Angabe;C;"Parvovirus B19; Komplikationen sind aplastische Krise (bei hämolytischer Anämie) und Hydrops fetalis in der Schwangerschaft.";schwer
151;Allergologie;Wie unterscheiden sich die Begriffe Sensibilisierung und Allergie?;Keine Angabe;Keine Angabe;"Sensibilisierung ist der Nachweis von spezifischem IgE (im Bluttest oder Pricktest) ohne zwingende Symptome; eine Allergie ist die klinisch manifeste, meist IgE-vermittelte Unverträglichkeitsreaktion.";Keine Angabe;C;"Sensibilisierung ist der Nachweis von spezifischem IgE (im Bluttest oder Pricktest) ohne zwingende Symptome; eine Allergie ist die klinisch manifeste, meist IgE-vermittelte Unverträglichkeitsreaktion.";mittel
152;Allergologie;Was beschreibt der ?atopische Marsch??;Keine Angabe;Keine Angabe;Keine Angabe;Die typische zeitliche Abfolge atopischer Erkrankungen ? oft beginnend mit atopischem Ekzem und Nahrungsmittelallergie im Säuglingsalter, später allergische Rhinitis und Asthma bronchiale.;D;Die typische zeitliche Abfolge atopischer Erkrankungen ? oft beginnend mit atopischem Ekzem und Nahrungsmittelallergie im Säuglingsalter, später allergische Rhinitis und Asthma bronchiale.;mittel
153;Allergologie;Was ist die Anaphylaxie?;Keine Angabe;Eine akute, potenziell lebensbedrohliche, meist IgE-vermittelte systemische allergische Reaktion mit Beteiligung mehrerer Organsysteme (Haut, Atemwege, Kreislauf, GIT).;Keine Angabe;Keine Angabe;B;Eine akute, potenziell lebensbedrohliche, meist IgE-vermittelte systemische allergische Reaktion mit Beteiligung mehrerer Organsysteme (Haut, Atemwege, Kreislauf, GIT).;mittel
154;Allergologie;Welches Medikament ist das Mittel der ersten Wahl bei der Anaphylaxie und wie wird es appliziert?;Adrenalin (Epinephrin) intramuskulär in den lateralen Oberschenkel.;Keine Angabe;Keine Angabe;Keine Angabe;A;Adrenalin (Epinephrin) intramuskulär in den lateralen Oberschenkel.;leicht
155;Allergologie;Welche Medikamente werden bei der Anaphylaxie zusätzlich (als Zweitlinie) eingesetzt?;Antihistaminika und Glukokortikoide sowie Sauerstoff/Volumen und bei Bronchospasmus inhalative Beta-2-Sympathomimetika.;Keine Angabe;Keine Angabe;Keine Angabe;A;Antihistaminika und Glukokortikoide sowie Sauerstoff/Volumen und bei Bronchospasmus inhalative Beta-2-Sympathomimetika.;mittel
156;Allergologie;Welche Selbsthilfemaßnahme/Notfallausrüstung sollte Patienten mit schwerer Anaphylaxiegefahr verordnet werden?;Keine Angabe;Keine Angabe;Keine Angabe;Ein Adrenalin-Autoinjektor (?Pen?) als Notfallset, inklusive Schulung.;D;Ein Adrenalin-Autoinjektor (?Pen?) als Notfallset, inklusive Schulung.;mittel
157;Allergologie;Welche Nahrungsmittel zählen im Kindesalter zu den häufigsten Auslösern einer Nahrungsmittelallergie?;Keine Angabe;Keine Angabe;Keine Angabe;Kuhmilch, Hühnerei, Erdnuss, Baumnüsse, Soja, Weizen und Fisch.;D;Kuhmilch, Hühnerei, Erdnuss, Baumnüsse, Soja, Weizen und Fisch.;mittel
158;Allergologie;Welches Diagnostikverfahren weist eine IgE-Sensibilisierung an der Haut nach?;Keine Angabe;Keine Angabe;Der Haut-Pricktest.;Keine Angabe;C;Der Haut-Pricktest.;leicht
159;Allergologie;Welche Erkrankung ist gemeint, wenn Heuschnupfen mit Niesen, Rhinorrhö und juckenden Augen saisonal auftritt?;Keine Angabe;Keine Angabe;Die allergische Rhinitis bzw. Rhinokonjunktivitis (z. B. Pollinosis).;Keine Angabe;C;Die allergische Rhinitis bzw. Rhinokonjunktivitis (z. B. Pollinosis).;leicht
160;Allergologie;Welche kausale (krankheitsmodifizierende) Therapie steht bei IgE-vermittelten Allergien (z. B. Insektengift, Pollen) zur Verfügung?;Keine Angabe;Keine Angabe;Keine Angabe;Die spezifische Immuntherapie (Hyposensibilisierung/Allergen-Immuntherapie).;D;Die spezifische Immuntherapie (Hyposensibilisierung/Allergen-Immuntherapie).;mittel
161;Allergologie;Welche allergische Erkrankung ist nach einem Insektenstich (Biene/Wespe) besonders gefährlich und wie wird langfristig vorgebeugt?;Keine Angabe;Keine Angabe;"Die Insektengiftallergie mit Anaphylaxiegefahr; langfristig durch spezifische Immuntherapie (Hyposensibilisierung) und Notfallset.";Keine Angabe;C;"Die Insektengiftallergie mit Anaphylaxiegefahr; langfristig durch spezifische Immuntherapie (Hyposensibilisierung) und Notfallset.";mittel
162;Pneumologie;Welches Krankheitsbild ist gemeint, wenn ein Kleinkind plötzlich aus voller Gesundheit Husten und einseitig abgeschwächtes Atemgeräusch entwickelt?;Keine Angabe;Keine Angabe;Keine Angabe;Eine Fremdkörperaspiration.;D;Eine Fremdkörperaspiration.;leicht
163;Pneumologie;Warum schließt ein unauffälliges Röntgenbild eine Fremdkörperaspiration nicht aus?;Keine Angabe;"Weil viele Fremdkörper nicht röntgendicht sind; ggf. zeigt erst die Exspirationsaufnahme indirekte Zeichen (Ventilmechanismus/Überblähung).";Keine Angabe;Keine Angabe;B;"Weil viele Fremdkörper nicht röntgendicht sind; ggf. zeigt erst die Exspirationsaufnahme indirekte Zeichen (Ventilmechanismus/Überblähung).";mittel
164;Pneumologie;Was ist der häufigste Auslöser des Krupp-Syndroms (Pseudokrupp) und wie klingt der typische Husten?;"Meist viral (Parainfluenza); typisch sind bellender Husten, Heiserkeit und inspiratorischer Stridor.";Keine Angabe;Keine Angabe;Keine Angabe;A;"Meist viral (Parainfluenza); typisch sind bellender Husten, Heiserkeit und inspiratorischer Stridor.";leicht
165;Pneumologie;Wie wird ein mittelschwerer/schwerer Pseudokrupp behandelt?;Keine Angabe;Mit Glukokortikoiden (oral, rektal oder inhalativ) und bei schwerer Atemnot zusätzlich inhalativem Adrenalin.;Keine Angabe;Keine Angabe;B;Mit Glukokortikoiden (oral, rektal oder inhalativ) und bei schwerer Atemnot zusätzlich inhalativem Adrenalin.;mittel
166;Pneumologie;Wie unterscheidet sich die Epiglottitis klinisch vom Pseudokrupp?;Die Epiglottitis verläuft akut hochfieberhaft mit Speichelfluss, Schluckschmerzen, kloßiger Sprache und sitzender Haltung ohne bellenden Husten ? ein Notfall.;Keine Angabe;Keine Angabe;Keine Angabe;A;Die Epiglottitis verläuft akut hochfieberhaft mit Speichelfluss, Schluckschmerzen, kloßiger Sprache und sitzender Haltung ohne bellenden Husten ? ein Notfall.;mittel
167;Pneumologie;Welcher Erreger verursacht klassischerweise die Epiglottitis und wodurch ist sie selten geworden?;"Haemophilus influenzae Typ b; durch die Hib-Impfung selten geworden.";Keine Angabe;Keine Angabe;Keine Angabe;A;"Haemophilus influenzae Typ b; durch die Hib-Impfung selten geworden.";mittel
168;Pneumologie;Was ist bei Verdacht auf Epiglottitis strikt zu vermeiden?;Keine Angabe;Das Kind nicht aufregen/hinlegen und keine Racheninspektion mit dem Spatel ? Gefahr des kompletten Atemwegsverschlusses.;Keine Angabe;Keine Angabe;B;Das Kind nicht aufregen/hinlegen und keine Racheninspektion mit dem Spatel ? Gefahr des kompletten Atemwegsverschlusses.;schwer
169;Pneumologie;Welche pathophysiologischen Komponenten kennzeichnen das Asthma bronchiale?;Chronische eosinophile Entzündung der Atemwege mit bronchialer Hyperreagibilität und (reversibler) Bronchialobstruktion.;Keine Angabe;Keine Angabe;Keine Angabe;A;Chronische eosinophile Entzündung der Atemwege mit bronchialer Hyperreagibilität und (reversibler) Bronchialobstruktion.;mittel
170;Pneumologie;Welches Medikament ist die Akut-/Bedarfstherapie beim Asthmaanfall?;Keine Angabe;Keine Angabe;Kurzwirksame inhalative Beta-2-Sympathomimetika (SABA, z. B. Salbutamol).;Keine Angabe;C;Kurzwirksame inhalative Beta-2-Sympathomimetika (SABA, z. B. Salbutamol).;leicht
171;Pneumologie;Welche Substanzklasse bildet die Basis der antiinflammatorischen Asthma-Dauertherapie?;Keine Angabe;Keine Angabe;Keine Angabe;Inhalative Glukokortikoide (ICS).;D;Inhalative Glukokortikoide (ICS).;mittel
172;Pneumologie;Welches Gen ist bei der zystischen Fibrose (Mukoviszidose) defekt und auf welchem Chromosom liegt es?;Keine Angabe;Keine Angabe;Das CFTR-Gen auf Chromosom 7.;Keine Angabe;C;Das CFTR-Gen auf Chromosom 7.;mittel
173;Pneumologie;Welcher Test sichert die Diagnose der zystischen Fibrose und welcher Chloridwert gilt als pathologisch?;Keine Angabe;Keine Angabe;Keine Angabe;"Der Schweißtest; zwei positive Tests mit Chloridkonzentration ? 60 mmol/l gelten als pathologisch (30?60 mmol/l = Graubereich).";D;"Der Schweißtest; zwei positive Tests mit Chloridkonzentration ? 60 mmol/l gelten als pathologisch (30?60 mmol/l = Graubereich).";schwer
174;Pneumologie;Welche frühe (oft neonatale) Manifestation der zystischen Fibrose betrifft den Darm?;Keine Angabe;Keine Angabe;Keine Angabe;Der Mekoniumileus.;D;Der Mekoniumileus.;mittel
175;Pneumologie;Welche typische Begleitstörung der zystischen Fibrose betrifft die Verdauung?;Keine Angabe;Keine Angabe;Die exokrine Pankreasinsuffizienz mit Maldigestion (Therapie mit Pankreasenzymen).;Keine Angabe;C;Die exokrine Pankreasinsuffizienz mit Maldigestion (Therapie mit Pankreasenzymen).;mittel
176;Pneumologie;Welche neuartige medikamentöse Therapie zielt direkt auf den Defekt der zystischen Fibrose?;Keine Angabe;CFTR-modulierende Therapien (Korrektoren/Potentiatoren, z. B. Kombinationen), abhängig von der Mutation.;Keine Angabe;Keine Angabe;B;CFTR-modulierende Therapien (Korrektoren/Potentiatoren, z. B. Kombinationen), abhängig von der Mutation.;schwer
177;Pneumologie;Welche Erreger sind im Kindesalter häufige Ursachen einer ambulant erworbenen Pneumonie?;Keine Angabe;Keine Angabe;"Bei jüngeren Kindern v. a. Viren und Pneumokokken; bei älteren Kindern auch Mycoplasma pneumoniae.";Keine Angabe;C;"Bei jüngeren Kindern v. a. Viren und Pneumokokken; bei älteren Kindern auch Mycoplasma pneumoniae.";mittel
178;Pneumologie;Welches Antibiotikum ist Mittel der Wahl bei der unkomplizierten ambulant erworbenen bakteriellen Pneumonie im Kindesalter?;Keine Angabe;Keine Angabe;Aminopenicillin (Amoxicillin), ggf. mit Betalaktamasehemmer.;Keine Angabe;C;Aminopenicillin (Amoxicillin), ggf. mit Betalaktamasehemmer.;mittel
179;Pneumologie;Wie unterscheidet man laborchemisch ein Transsudat von einem Exsudat beim Pleuraerguss (Grundprinzip)?;Keine Angabe;Keine Angabe;"Transsudat (z. B. bei Herzinsuffizienz) ist eiweiß-/LDH-arm durch erhöhten hydrostatischen Druck; Exsudat (z. B. bei bakterieller Pneumonie/Pleuritis) ist eiweiß-/LDH-reich durch erhöhte Gefäßpermeabilität.";Keine Angabe;C;"Transsudat (z. B. bei Herzinsuffizienz) ist eiweiß-/LDH-arm durch erhöhten hydrostatischen Druck; Exsudat (z. B. bei bakterieller Pneumonie/Pleuritis) ist eiweiß-/LDH-reich durch erhöhte Gefäßpermeabilität.";schwer
180;Kardiologie;Welcher angeborene Herzfehler ist der häufigste?;Der Ventrikelseptumdefekt (VSD), etwa 50 % der angeborenen Herzfehler.;Keine Angabe;Keine Angabe;Keine Angabe;A;Der Ventrikelseptumdefekt (VSD), etwa 50 % der angeborenen Herzfehler.;leicht
181;Kardiologie;Wie teilt man angeborene Herzfehler grob nach der Klinik ein?;Keine Angabe;Keine Angabe;Keine Angabe;In azyanotische (meist Links-Rechts-Shunt) und zyanotische (Rechts-Links-Shunt) Herzfehler.;D;In azyanotische (meist Links-Rechts-Shunt) und zyanotische (Rechts-Links-Shunt) Herzfehler.;mittel
182;Kardiologie;Welche Shuntrichtung liegt einem unkomplizierten VSD zunächst zugrunde und welche Spätkomplikation droht bei großem Shunt?;Keine Angabe;Keine Angabe;Keine Angabe;"Links-Rechts-Shunt; bei pulmonaler Druckerhöhung droht die Shuntumkehr (Eisenmenger-Syndrom) mit dann zyanotischem Herzfehler.";D;"Links-Rechts-Shunt; bei pulmonaler Druckerhöhung droht die Shuntumkehr (Eisenmenger-Syndrom) mit dann zyanotischem Herzfehler.";schwer
183;Kardiologie;Welche vier Komponenten umfasst die Fallot-Tetralogie?;Keine Angabe;Keine Angabe;Großer VSD, über dem VSD ?reitende? Aorta, Pulmonalstenose (rechtsventrikuläre Ausflussbahnobstruktion) und rechtsventrikuläre Hypertrophie.;Keine Angabe;C;Großer VSD, über dem VSD ?reitende? Aorta, Pulmonalstenose (rechtsventrikuläre Ausflussbahnobstruktion) und rechtsventrikuläre Hypertrophie.;schwer
184;Kardiologie;Was ist ein ?hypoxämischer Anfall? (Tet-Spell) bei der Fallot-Tetralogie?;"Eine akute Zunahme des Rechts-Links-Shunts mit plötzlicher tiefer Zyanose; Kinder gehen typischerweise in die Hocke (Hockstellung erhöht den Systemwiderstand).";Keine Angabe;Keine Angabe;Keine Angabe;A;"Eine akute Zunahme des Rechts-Links-Shunts mit plötzlicher tiefer Zyanose; Kinder gehen typischerweise in die Hocke (Hockstellung erhöht den Systemwiderstand).";schwer
185;Kardiologie;Welche Sofortmaßnahme verbessert beim ductusabhängigen zyanotischen Herzfehler des Neugeborenen die Oxygenierung?;Offenhalten des Ductus arteriosus mit Prostaglandin E (PGE1-Infusion).;Keine Angabe;Keine Angabe;Keine Angabe;A;Offenhalten des Ductus arteriosus mit Prostaglandin E (PGE1-Infusion).;schwer
186;Kardiologie;Welcher zyanotische Herzfehler ist dadurch gekennzeichnet, dass Aorta und Pulmonalarterie vertauscht entspringen?;Keine Angabe;Keine Angabe;Die Transposition der großen Arterien (d-TGA).;Keine Angabe;C;Die Transposition der großen Arterien (d-TGA).;mittel
187;Kardiologie;Welcher azyanotische Herzfehler verursacht ein kontinuierliches (Maschinen-)Geräusch und ist beim Frühgeborenen relevant?;Keine Angabe;Keine Angabe;Der persistierende Ductus arteriosus (PDA).;Keine Angabe;C;Der persistierende Ductus arteriosus (PDA).;mittel
188;Kardiologie;Welche Fehlbildung verursacht abgeschwächte/fehlende Leistenpulse und eine Blutdruckdifferenz zwischen Armen und Beinen?;Die Aortenisthmusstenose (Coarctatio aortae).;Keine Angabe;Keine Angabe;Keine Angabe;A;Die Aortenisthmusstenose (Coarctatio aortae).;mittel
189;Kardiologie;Welcher Vorhofseptumdefekt-Typ ist am häufigsten und welches Auskultationszeichen ist typisch?;Keine Angabe;"Der ASD II (Ostium-secundum-Defekt); typisch ist eine fixierte (atemunabhängige) Spaltung des 2. Herztons.";Keine Angabe;Keine Angabe;B;"Der ASD II (Ostium-secundum-Defekt); typisch ist eine fixierte (atemunabhängige) Spaltung des 2. Herztons.";schwer
190;Kardiologie;Welche Erkrankung kann ein Säugling mit Herzinsuffizienzzeichen wie Trinkschwäche, Schwitzen beim Trinken und Tachydyspnoe haben?;Keine Angabe;Einen relevanten angeborenen Herzfehler mit Herzinsuffizienz (z. B. großer Links-Rechts-Shunt).;Keine Angabe;Keine Angabe;B;Einen relevanten angeborenen Herzfehler mit Herzinsuffizienz (z. B. großer Links-Rechts-Shunt).;mittel
191;Kardiologie;Welche Infektion der Herzinnenhaut wird bei Risikopatienten durch eine Endokarditisprophylaxe verhindert?;Keine Angabe;Keine Angabe;Die infektiöse (bakterielle) Endokarditis.;Keine Angabe;C;Die infektiöse (bakterielle) Endokarditis.;mittel
192;Kardiologie;Vor welchen Eingriffen wird Hochrisikopatienten eine Endokarditisprophylaxe empfohlen?;Vor bestimmten zahnärztlichen Eingriffen mit Manipulation der Gingiva/Schleimhaut (bei definierten kardialen Hochrisikokonstellationen).;Keine Angabe;Keine Angabe;Keine Angabe;A;Vor bestimmten zahnärztlichen Eingriffen mit Manipulation der Gingiva/Schleimhaut (bei definierten kardialen Hochrisikokonstellationen).;schwer
193;Kardiologie;Welche entzündliche Herzerkrankung kann nach viralen Infekten mit Herzinsuffizienz, Tachykardie und Troponinanstieg auftreten?;Keine Angabe;Keine Angabe;Keine Angabe;Die Myokarditis.;D;Die Myokarditis.;mittel
194;Kardiologie;Welche Rhythmusstörung ist die häufigste symptomatische supraventrikuläre Tachykardie im Säuglings-/Kindesalter und wie wird sie akut terminiert?;Keine Angabe;Keine Angabe;"Die AV-Knoten-Reentry-/AV-Reentry-Tachykardie; akut durch Vagusmanöver und ggf. Adenosin i.v.";Keine Angabe;C;"Die AV-Knoten-Reentry-/AV-Reentry-Tachykardie; akut durch Vagusmanöver und ggf. Adenosin i.v.";schwer
195;Kardiologie;Welches Screening dient der frühen Erkennung kritischer zyanotischer Herzfehler beim Neugeborenen?;Keine Angabe;Keine Angabe;Das Pulsoxymetrie-Screening (Messung der Sauerstoffsättigung).;Keine Angabe;C;Das Pulsoxymetrie-Screening (Messung der Sauerstoffsättigung).;mittel
196;Kardiologie;Welcher angeborene Herzfehler tritt beim Down-Syndrom besonders häufig auf?;Der atrioventrikuläre Septumdefekt (AVSD).;Keine Angabe;Keine Angabe;Keine Angabe;A;Der atrioventrikuläre Septumdefekt (AVSD).;mittel
197;Gastroenterologie/Hepatologie;Welche Erkrankung ist eine immunvermittelte Unverträglichkeit gegen Gluten mit Dünndarmschädigung?;Keine Angabe;Die Zöliakie (glutensensitive Enteropathie).;Keine Angabe;Keine Angabe;B;Die Zöliakie (glutensensitive Enteropathie).;leicht
198;Gastroenterologie/Hepatologie;Welche Antikörper sind der wichtigste serologische Marker der Zöliakie?;Keine Angabe;Keine Angabe;Keine Angabe;Transglutaminase-2-IgA-Antikörper (bei IgA-Mangel die IgG-Variante), ergänzt durch Endomysium-Antikörper.;D;Transglutaminase-2-IgA-Antikörper (bei IgA-Mangel die IgG-Variante), ergänzt durch Endomysium-Antikörper.;mittel
199;Gastroenterologie/Hepatologie;Welcher Befund sichert die Zöliakie histologisch und nach welcher Klassifikation wird er beurteilt?;Die Zottenatrophie der Dünndarmschleimhaut (Duodenalbiopsie), beurteilt nach der Marsh-Klassifikation.;Keine Angabe;Keine Angabe;Keine Angabe;A;Die Zottenatrophie der Dünndarmschleimhaut (Duodenalbiopsie), beurteilt nach der Marsh-Klassifikation.;mittel
200;Gastroenterologie/Hepatologie;Worin besteht die einzige kausale Therapie der Zöliakie?;Keine Angabe;Keine Angabe;Eine lebenslange streng glutenfreie Ernährung.;Keine Angabe;C;Eine lebenslange streng glutenfreie Ernährung.;leicht
201;Gastroenterologie/Hepatologie;Welche Erkrankung verursacht beim Säugling (ca. 3.?6. Lebenswoche) nicht-galliges schwallartiges Erbrechen?;Die hypertrophe Pylorusstenose.;Keine Angabe;Keine Angabe;Keine Angabe;A;Die hypertrophe Pylorusstenose.;mittel
202;Gastroenterologie/Hepatologie;Welche Elektrolyt-/Säure-Basen-Störung ist typisch für die Pylorusstenose?;Keine Angabe;Eine hypochlorämische, hypokaliämische metabolische Alkalose.;Keine Angabe;Keine Angabe;B;Eine hypochlorämische, hypokaliämische metabolische Alkalose.;schwer
203;Gastroenterologie/Hepatologie;Welche Erkrankung verursacht beim Säugling kolikartige Bauchschmerzen mit schmerzfreien Intervallen und ggf. ?himbeergeleeartigen? Stühlen?;Keine Angabe;Keine Angabe;Die Invagination (Darmeinstülpung).;Keine Angabe;C;Die Invagination (Darmeinstülpung).;mittel
204;Gastroenterologie/Hepatologie;Wie wird eine unkomplizierte Invagination häufig behandelt?;Durch hydrostatische oder pneumatische Reposition (Sonografie-/Röntgen-gesteuert), bei Versagen operativ.;Keine Angabe;Keine Angabe;Keine Angabe;A;Durch hydrostatische oder pneumatische Reposition (Sonografie-/Röntgen-gesteuert), bei Versagen operativ.;mittel
205;Gastroenterologie/Hepatologie;Welche angeborene Erkrankung beruht auf dem Fehlen von Ganglienzellen im distalen Darm und führt zu schwerer Obstipation/Ileus?;Keine Angabe;Keine Angabe;Keine Angabe;Der Morbus Hirschsprung (Aganglionose).;D;Der Morbus Hirschsprung (Aganglionose).;mittel
206;Gastroenterologie/Hepatologie;Welcher Erreger ist weltweit die häufigste Ursache einer akuten Gastroenteritis mit Durchfall im Kleinkindalter?;Keine Angabe;Keine Angabe;Keine Angabe;Das Rotavirus.;D;Das Rotavirus.;leicht
207;Gastroenterologie/Hepatologie;Worin besteht die wichtigste Therapie der akuten Gastroenteritis im Kindesalter?;Keine Angabe;Keine Angabe;Keine Angabe;Die orale Rehydratation (mit oraler Rehydratationslösung), ggf. intravenöse Rehydratation bei schwerer Dehydratation.;D;Die orale Rehydratation (mit oraler Rehydratationslösung), ggf. intravenöse Rehydratation bei schwerer Dehydratation.;leicht
208;Gastroenterologie/Hepatologie;Wie unterscheiden sich Morbus Crohn und Colitis ulcerosa in der Ausbreitung?;Keine Angabe;"Morbus Crohn: diskontinuierlicher, segmentaler Befall des gesamten GI-Trakts (transmural); Colitis ulcerosa: kontinuierlicher Befall, auf das Kolon beschränkt (mukosal), vom Rektum aufsteigend.";Keine Angabe;Keine Angabe;B;"Morbus Crohn: diskontinuierlicher, segmentaler Befall des gesamten GI-Trakts (transmural); Colitis ulcerosa: kontinuierlicher Befall, auf das Kolon beschränkt (mukosal), vom Rektum aufsteigend.";schwer
209;Gastroenterologie/Hepatologie;Welche typische Komplikation/Manifestation ist eher mit Morbus Crohn assoziiert?;Keine Angabe;Keine Angabe;Fisteln, Stenosen, perianale Läsionen und Befall des terminalen Ileums.;Keine Angabe;C;Fisteln, Stenosen, perianale Läsionen und Befall des terminalen Ileums.;mittel
210;Gastroenterologie/Hepatologie;Welche häufige akute chirurgische Ursache von Bauchschmerzen zeigt Schmerzwanderung in den rechten Unterbauch (McBurney) mit Loslassschmerz?;Keine Angabe;Keine Angabe;Keine Angabe;Die Appendizitis.;D;Die Appendizitis.;leicht
211;Gastroenterologie/Hepatologie;Was ist die häufigste Ursache einer konjugierten (direkten) Hyperbilirubinämie/Cholestase beim jungen Säugling, die rasch erkannt werden muss?;Die Gallengangsatresie (Gallengangatresie).;Keine Angabe;Keine Angabe;Keine Angabe;A;Die Gallengangsatresie (Gallengangatresie).;schwer
